Publication ID,HC Number,Session,Committee Name,House,Report Title,Report Ordinal,Publication Date,Publication Time,Late by min,Late by max
51360,HC 536,2024-26,Procedure Committee,Commons,Call lists,4th Report,2026-02-03,10:00:00,,3:48:35
51367,HC 1411,2024-26,Business and Trade Committee,Commons,Priorities of the Business and Trade Committee for 2026,13th Report,2026-02-03,00:00:00,,13:48:35
51336,HC 1658,2024-26,Defence Committee,Commons,The UK contribution to European Security: Government Response,6th Special Report,2026-01-30,11:00:00,,"4 days, 2:48:35"
51345,HC 291-xlvi,2024-26,Statutory Instruments (Joint Committee),Joint,Forty-sixth Report - 3 Statutory Instruments Reported,,2026-01-30,11:00:00,,"4 days, 2:48:35"
51312,HC 1620,2024-26,Welsh Affairs Committee,Commons,Farming in Wales in 2025: Challenges and Opportunities: Government Response,1st Special Report,2026-01-30,09:00:00,,"4 days, 4:48:35"
51305,HC 571,2024-26,Women and Equalities Committee,Commons,"Discrimination, harassment and abuse against Muslim women",10th Report,2026-01-30,00:01:00,,"4 days, 13:47:35"
51310,HC 571,2024-26,Women and Equalities Committee,Commons,"Large Print – 10th Report – Discrimination, harassment and abuse against Muslim women",,2026-01-30,00:01:00,,"4 days, 13:47:35"
51330,HC 1639,2024-26,Justice Committee,Commons,Ending the cycle of reoffending – part one: rehabilitation in prisons: Government Response,4th Special Report,2026-01-30,00:01:00,,"4 days, 13:47:35"
51334,HC 1234,2024-26,Public Accounts Committee,Commons,Costs of clinical negligence,64th Report,2026-01-30,00:01:00,,"4 days, 13:47:35"
51344,HC 1651,2024-26,Scottish Affairs Committee,Commons,"The work of the Committee in 2024-25, and Industrial transition in Scotland",5th Report,2026-01-30,00:01:00,,"4 days, 13:47:35"
51276,HC 1239,2024-26,Public Accounts Committee,Commons,Increasing police productivity,63rd Report,2026-01-28,00:01:00,,"6 days, 13:47:35"
51283,HC 1223,2024-26,Transport Committee,Commons,Engine for growth: securing skills for transport manufacturing,5th Report,2026-01-28,00:01:00,,"6 days, 13:47:35"
51245,HC 1640,2024-26,Women and Equalities Committee,Commons,Female entrepreneurship: Government Response,8th Special Report,2026-01-27,00:01:00,,"7 days, 13:47:35"
51246,HC 1640,2024-26,Women and Equalities Committee,Commons,Large Print: 8th Special Report - Female entrepreneurship: Government Response,,2026-01-27,00:01:00,,"7 days, 13:47:35"
51226,HC 291-xlv,2024-26,Statutory Instruments (Joint Committee),Joint,Forty-fifth Report - 4 Statutory Instruments Reported,,2026-01-23,11:00:00,,"11 days, 2:48:35"
51228,HC 1616,2024-26,Committee of Privileges,Commons,Matter referred on 14 July 2025 (Omagh Bombing Inquiry): Government Response,1st Special Report,2026-01-23,11:00:00,,"11 days, 2:48:35"
51210,HC 1229,2024-26,Public Accounts Committee,Commons,Faulty energy efficiency installations,62nd Report,2026-01-23,00:01:00,,"11 days, 13:47:35"
51224,HC 1652,2024-26,Scottish Affairs Committee,Commons,Draft Scotland Act 1998 (Modification of Schedule 5) Order 2026,6th Report,2026-01-23,00:01:00,,"11 days, 13:47:35"
51202,HC 1642,2024-26,Home Affairs Committee,Commons,The Home Office’s management of asylum accommodation: Government Response,3rd Special Report,2026-01-22,10:00:00,,"12 days, 3:48:35"
51183,HC 802,2024-26,Health and Social Care Committee,Commons,First 1000 days: a renewed focus,5th Report,2026-01-22,00:01:00,,"12 days, 13:47:35"
51188,HC 1626,2024-26,International Development Committee,Commons,Empowering Development: Energy Access for Communities: Government response,7th Special Report,2026-01-22,00:01:00,,"12 days, 13:47:35"
51189,HC 1626,2024-26,International Development Committee,Commons,Large Print - 7th Special Report - Empowering Development: Energy Access for Communities: Government response,,2026-01-22,00:01:00,,"12 days, 13:47:35"
51209,HC 1625,2024-26,Treasury Committee,Commons,Taxation of gambling: Government Response,6th Special Report,2026-01-22,00:01:00,,"12 days, 13:47:35"
51129,HC 1624,2024-26,Energy Security and Net Zero Committee,Commons,Tackling the energy cost crisis: Government Response,4th Special Report,2026-01-21,00:01:00,,"13 days, 13:47:35"
51386,HC 1235,2024-26,Public Accounts Committee,Commons,Efficiency and resilience of the Probation Service,65th Report,2026-02-04,00:01:00,,5:00:21
51434,HC 1661,2024-26,"Environment, Food and Rural Affairs Committee",Commons,UK-EU agritrade: making an SPS agreement work,5th Report,2026-02-05,00:01:00,,5:09:14
51458,HC 1330,2024-26,International Development Committee,Commons,Future of UK aid and development assistance: interim report,9th Report,2026-02-05,00:01:00,,5:09:14
51459,HC 1330,2024-26,International Development Committee,Commons,Large Print - 9th Report -Future of UK aid and development assistance: interim report,,2026-02-05,00:01:00,,5:09:14
51436,HC 1666,2024-26,Business and Trade Committee,Commons,Toward a new doctrine for economic security: Government Response,14th Report,2026-02-04,21:30:00,,7:40:14
51437,HC 1666,2024-26,"Business and Trade Sub-Committee on Economic Security, Arms and Export Controls",Commons,Toward a new doctrine for economic security: Government Response,14th Report,2026-02-04,21:30:00,,7:40:14
51464,HC 1663,2024-26,Women and Equalities Committee,Commons,Tackling HIV transmission: Government Response,9th Special Report,2026-02-06,00:01:00,,0:01:46
51466,HC 1663,2024-26,Women and Equalities Committee,Commons,Large print - 9th Special Report - Tackling HIV transmission: Government Response,,2026-02-06,00:01:00,,0:01:46
51484,HC 1679,2024-26,Transport Committee,Commons,Sifting of proposed negative Statutory instruments,6th Report,2026-02-06,00:01:00,,0:01:46
51442,HC 1576,2024-26,Restoration and Renewal Client Board,Joint,Delivering restoration  and renewal of the  Palace of Westminster: the costed proposals,,2026-02-05,14:00:00,,10:02:46
51463,,,Restoration and Renewal Client Board,Joint,Delivering restoration  and renewal of the  Palace of Westminster: a summary of the  costed proposals,,2026-02-05,14:00:00,,10:02:46
51467,HC 1576,2024-26,Restoration and Renewal Client Board,Joint,Large Print - Delivering restoration and renewal of the Palace of Westminster: the costed proposals,,2026-02-05,14:00:00,,10:02:46
51468,,,Restoration and Renewal Client Board,Joint,Large Print - Delivering restoration  and renewal of the  Palace of Westminster: a summary of the  costed proposals,,2026-02-05,14:00:00,,10:02:46
51470,,,Restoration and Renewal Client Board,Joint,Audio - Delivering restoration  and renewal of the  Palace of Westminster: a summary of the  costed proposals,,2026-02-05,14:00:00,,10:02:46
51465,HC 291-xlvii,2024-26,Statutory Instruments (Joint Committee),Joint,Forty-seventh Report - 5 Statutory Instruments Reported,,2026-02-06,11:00:00,,0:04:04
51494,HC 1692,2024-26,Speaker's Committee on the Electoral Commission,Commons,Appointment of an Electoral Commissioner,1st Report,2026-02-09,11:00:00,,0:12:22
51492,HC 1580,2024-26,Northern Ireland Affairs Committee,Commons,Operation Kenova: naming Stakeknife,3rd Report,2026-02-09,00:01:00,,11:11:22
51493,HC 1154,2024-26,"Housing, Communities and Local Government Committee",Commons,Housing Conditions in the Social Rented Sector,4th Report,2026-02-09,00:01:00,,11:11:22
51518,HC 575,2024-26,Transport Committee,Commons,Rail investment pipelines: ending boom and bust,7th Report,2026-02-10,00:01:00,5:52:37,13:07:07
51519,HC 1472,2024-26,Transport Committee,Commons,Railways Bill,8th Report,2026-02-10,00:01:00,5:52:37,13:07:07
51536,HC 1057,2024-26,Business and Trade Committee,Commons,Small business strategy,15th Report,2026-02-11,00:01:00,,9:46:15
51539,HC 1231,2024-26,Public Accounts Committee,Commons,Tackling fraud and error in benefit expenditure 2024-25,66th Report,2026-02-11,00:01:00,,9:46:15
51540,HC 294-xii,2024-26,Statutory Instruments (Select Committee),Commons,Twelfth Report of Session 2024-26 - No Statutory Instruments Reported,,2026-02-11,00:01:00,,9:46:15
51551,HC 1669,2024-26,International Development Committee,Commons,"Assessing Value, Ensuring Impact: The FCDO’s Approach to Value for Money in Official Development Assistance: Government Response",8th Special Report,2026-02-11,00:01:00,,9:46:15
51565,HC 1669,2024-26,International Development Committee,Commons,"Large Print - 8th Special Report: Assessing Value, Ensuring Impact: The FCDO’s Approach to Value for Money in Official Development Assistance: Government Response HC 1669",,2026-02-11,00:01:00,,9:46:15
51534,HC 1399,2024-26,Education Committee,Commons,Foundations of Learning: replacing RAAC and securing school buildings,7th Report,2026-02-11,00:00:00,,9:47:15
51535,HC 535,2024-26,Procedure Committee,Commons,Elections within the House of Commons,5th Report,2026-02-11,10:00:00,,1:18:44
51609,HC 1708,2024-26,Scottish Affairs Committee,Commons,Draft Scotland Act 1998 (Modification of Schedule 5) Order 2026: Government Response,7th Special Report,2026-02-12,00:00:00,,0:32:29
51613,HC 1700,2024-26,National Security Strategy (Joint Committee),Joint,Espionage cases and the Official Secrets Acts: Government and Crown Prosecution Service Responses,2nd Special Report,2026-02-12,00:00:00,,0:32:29
51664,,,Restoration and Renewal Client Board,Joint,BSL - Delivering restoration and renewal of the Palace of Westminster: the costed proposals,,2026-02-11,18:20:00,,6:12:29
51663,HC 1716,2024-26,Northern Ireland Affairs Committee,Commons,The Government’s new approach to addressing the legacy of the past in Northern Ireland: Government Response,3rd Special Report,2026-02-12,14:00:00,,0:33:34
51662,HC 1237,2024-26,Public Accounts Committee,Commons,NS&I’s transformation programme,67th Report,2026-02-13,00:01:00,,0:35:39
51670,HC 291-xlviii,2024-26,Statutory Instruments (Joint Committee),Joint,Forty-eighth Report - 1 Statutory Instrument Reported,,2026-02-13,11:00:00,,0:38:57
51713,HC 869,2024-26,Women and Equalities Committee,Commons,Cosmetic procedures,11th Report,2026-02-18,00:01:00,,3:13:10
51714,HC 869,2024-26,Women and Equalities Committee,Commons,Large Print – 11th Report – Cosmetic procedures,,2026-02-18,00:01:00,,3:13:10
51716,HC 1722,2024-26,Health and Social Care Committee,Commons,Evaluation of Palliative care in England: Government Response,4th Special Report,2026-02-19,00:00:00,,3:12:18
51721,HC 1553,2024-26,Home Affairs Committee,Commons,Maccabi Tel Aviv fan ban,5th Report,2026-02-22,00:00:00,,3:13:59
51722,HC 1711,2024-26,Public Accounts Committee,Commons,Excess Votes 2024-25,68th Report,2026-02-23,00:01:00,,3:15:17
51820,HC 1697,2024-26,Human Rights (Joint Committee),Joint,Draft Northern Ireland Troubles (Legacy and Reconciliation) Act 2023 (Remedial) Order 2025: Second Report: Government Response,8th Special Report,2026-02-26,00:01:00,,2:50:50
51819,HC 1715,2024-26,Speaker's Committee for the Independent Parliamentary Standards Authority,Commons,Statement on IPSA’s Supplementary estimate 2025/26,1st Report,2026-02-26,11:00:00,,0:47:58
51817,HC 1723,2024-26,Business and Trade Committee,Commons,Pre-appointment hearing with the Government's preferred candidate for the Chair of the Competition and Markets Authority,17th Report,2026-02-26,15:00:00,,11:49:34
51834,HC 1704,2024-26,Energy Security and Net Zero Committee,Commons,"Workforce planning to deliver clean, secure energy: Government Response",5th Special Report,2026-02-27,11:00:00,,0:39:45
51867,HC 291-xlix,2024-26,Statutory Instruments (Joint Committee),Joint,Forty-ninth Report - 3 Statutory Instruments Reported,,2026-02-27,11:00:00,,0:39:45
51887,HC 1265,2024-26,Women and Equalities Committee,Commons,Menstrual health of girls and young women,12th Report,2026-03-04,00:01:00,,2:47:06
51888,HC 1265,2024-26,Women and Equalities Committee,Commons,Large Print – 12th Report – Menstrual health of girls and young women,,2026-03-04,00:01:00,,2:47:06
51939,HC 857,2024-26,Foreign Affairs Committee,Commons,From a Common Understanding to Common Ground: Building a UK-EU Strategic Partnership fit for the future,3rd Report,2026-03-04,00:01:00,,2:47:06
51954,HC 1243,2024-26,Public Accounts Committee,Commons,Whole of Government Accounts 2023-24,69th Report,2026-03-04,00:01:00,,2:47:06
51961,HC 1265,2024-26,Women and Equalities Committee,Commons,Easy Read – 12th Report – Menstrual health of girls and young women,,2026-03-04,00:01:00,,2:47:06
51956,HC 1327,2024-26,Environmental Audit Committee,Commons,The Seventh Carbon Budget,8th Report,2026-03-04,00:00:00,,2:48:06
52006,HC 1265,2024-26,Women and Equalities Committee,Commons,BSL report summary – 12th Report – Menstrual health of girls and young women,,2026-03-04,00:01:00,2:47:06,"1 day, 2:49:29"
51986,HC 1740,2024-26,Backbench Business Committee,Commons,15th anniversary of the Backbench Business Committee: Government Response,2nd Special Report,2026-03-05,09:00:00,,0:54:01
51985,HC 1709,2024-26,Speaker's Conference (2024),Commons,"Speaker’s Conference on the security of MPs, candidates and elections: Government Response",1st Special Report,2026-03-05,11:00:00,,0:41:30
51988,HC 1659,2024-26,Royal Albert Hall Bill [HL],Commons,Special Report on the Royal Albert Hall Bill [HL],1st Special Report,2026-03-05,11:00:00,,0:41:30
52008,HC 1709,2024-26,Speaker's Conference (2024),Commons,"Speaker’s Conference on the security of MPs, candidates and elections: Government Response",1st Special Report,2026-03-05,11:00:00,,0:41:30
52022,HC 1510,2024-26,Members Estimate Committee,Commons,Consolidated list of provisions of the Resolutions of the House relating to expenditure charged to the Estimate for House of Commons: Members as at 9 February 2026,2nd Report,2026-03-05,11:00:00,,0:41:30
52039,HC 1238,2024-26,Public Accounts Committee,Commons,Home-to-school transport,70th Report,2026-03-06,00:01:00,,2:47:33
52035,HC 291-l,2024-26,Statutory Instruments (Joint Committee),Joint,Fiftieth Report - No Statutory Instruments Reported,,2026-03-06,11:00:00,,0:37:33
52061,HC 1521,2024-26,Public Accounts Committee,Commons,Government’s use of external consultants,71st Report,2026-03-11,00:01:00,,2:46:23
52067,HC 1709,2024-26,Speaker's Conference (2024),Commons,"Large Print -  1st Special Report: Speaker’s Conference on the security of MPs, candidates and elections: Government Response",,2026-03-05,13:00:00,13:48:33,"5 days, 13:47:23"
52068,HC 1709,2024-26,Speaker's Conference (2024),Commons,"Large Print -  1st Special Report: Speaker’s Conference on the security of MPs, candidates and elections: Government Response",,2026-03-05,13:00:00,13:48:33,"5 days, 13:47:23"
52132,HC 1299,2024-26,Public Accounts Committee,Commons,BBC World Service,72nd Report,2026-03-13,00:01:00,,0:19:24
52134,HC 538,2024-26,"Science, Innovation and Technology Committee",Commons,"Flying Blind: Innovation, Growth and the Regions",3rd Report,2026-03-13,00:01:00,,0:19:24
52110,HC 1598,2024-26,Business and Trade Committee,Commons,Post Office Horizon scandal: Justice for sub-postmasters,16th Report,2026-03-13,00:00:00,,0:20:24
52135,HC 1785,2024-26,Environmental Audit Committee,Commons,Environmental sustainability and housing growth: Government Response,8th Special Report,2026-03-13,00:00:00,,0:20:24
52133,HC 291-li,2024-26,Statutory Instruments (Joint Committee),Joint,Fifty-first Report - 2 Statutory Instruments Reported,,2026-03-13,11:00:00,,0:20:21
52138,HC 1409,2024-26,Home Affairs Committee,Commons,Earned Settlement: Examining the Government’s proposed reforms,6th Report,2026-03-13,11:00:00,,0:20:21
52137,HC 1748,2024-26,Justice Committee,Commons,Appointment of the Chair of the Office for Legal Complaints,8th Report,2026-03-13,14:00:00,,10:20:26
52478,,,Restoration and Renewal Programme Board,Joint,Restoration and Renewal Quarterly Report Q3 October - December 2025,,2026-04-02,16:00:00,,"4 days, 22:35:49"
52458,HC 903,2024-26,Home Affairs Committee,Commons,Combatting new forms of extremism,7th Report,2026-04-01,00:01:00,,"6 days, 14:34:49"
52441,HC 702,2024-26,Welsh Affairs Committee,Commons,The Future of HMP Parc,3rd Report,2026-03-30,00:01:00,,"8 days, 14:34:49"
52411,HC 1771,2024-26,Justice Committee,Commons,Appointment of Monisha Shah as Chair of the Legal Services Board,9th Report,2026-03-27,12:00:00,,"11 days, 2:35:49"
52412,HC 291-lii,2024-26,Statutory Instruments (Joint Committee),Joint,Fifty-second Report - 2 Statutory Instruments Reported,,2026-03-27,11:00:00,,"11 days, 3:35:49"
52398,HC 1428,2024-26,Defence Committee,Commons,Pre-Appointment Hearing: Armed Forces Commissioner,7th Report,2026-03-27,09:00:00,,"11 days, 5:35:49"
52388,HC 1045,2024-26,National Security Strategy (Joint Committee),Joint,The National Security Strategy,4th Report,2026-03-27,00:01:00,,"11 days, 14:34:49"
52395,HC 1713,2024-26,Education Committee,Commons,Historical Forced Adoption,8th Report,2026-03-27,00:01:00,,"11 days, 14:34:49"
52403,HC 891,2024-26,Public Accounts Committee,Commons,Government use of data analytics on error and fraud,75th Report,2026-03-27,00:01:00,,"11 days, 14:34:49"
52401,HC 703,2024-26,Foreign Affairs Committee,Commons,Disinformation diplomacy: How malign actors are seeking to undermine democracy,4th Report,2026-03-27,00:00:00,,"11 days, 14:35:49"
52393,HC 1814,2024-26,Procedure Committee,Commons,Call lists: Government Response,5th Special Report,2026-03-26,10:00:00,,"12 days, 4:35:49"
52327,HC 1687,2024-26,Public Accounts Committee,Commons,Environmental regulation,74th Report,2026-03-25,00:01:00,,"13 days, 14:34:49"
52277,HC 1763,2024-26,Health and Social Care Committee,Commons,Palliative Care,6th Report,2026-03-24,00:01:00,,"14 days, 14:34:49"
52264,HC 1193,2024-26,Northern Ireland Affairs Committee,Commons,Economic growth in Northern Ireland: new and emerging sectors,4th Report,2026-03-23,00:01:00,,"15 days, 14:34:49"
52272,HC 782,2024-26,International Development Committee,Commons,"Peace under pressure: Protecting Women, Peace and Security",10th Report,2026-03-23,00:01:00,,"15 days, 14:34:49"
52276,HC 782,2024-26,International Development Committee,Commons,"Large Print - 10th Report - Peace under pressure: Protecting Women, Peace and Security",,2026-03-23,00:01:00,,"15 days, 14:34:49"
52250,HC 1781,2024-26,"Housing, Communities and Local Government Committee",Commons,Delivering 1.5 Million New Homes: Land Value Capture: Government Response,6th Special Report,2026-03-20,11:00:00,,"18 days, 3:35:49"
52249,HC 1317,2024-26,"Environment, Food and Rural Affairs Committee",Commons,Erosion of trust: the impact of coastal erosion on communities,6th Report,2026-03-20,00:00:00,,"18 days, 14:35:49"
52197,HC 1726,2024-26,Modernisation Committee,Commons,Access to the House of Commons and its procedures: House Administration Response,1st Special Report,2026-03-19,10:00:00,,"19 days, 4:35:49"
52205,HC 1726,2024-26,Modernisation Committee,Commons,Large Print – 1st Special Report – Access to the House of Commons and its procedures: House Administration Response,,2026-03-19,10:00:00,,"19 days, 4:35:49"
52210,HC 1726,2024-26,Modernisation Committee,Commons,Easy Read – 1st Special Report – Access to the House of Commons and its procedures: House Administration Response,,2026-03-19,10:00:00,,"19 days, 4:35:49"
52211,HC 1726,2024-26,Modernisation Committee,Commons,Easy Read Annex A – 1st Special Report – Access to the House of Commons and its procedures: House Administration Response,,2026-03-19,10:00:00,,"19 days, 4:35:49"
52215,HC 1726,2024-26,Modernisation Committee,Commons,BSL – 1st Special Report – Access to the House of Commons and its procedures: House Administration Response,,2026-03-19,10:00:00,,"19 days, 4:35:49"
52535,HC 294-xiii,2024-26,Statutory Instruments (Select Committee),Commons,Thirteenth Report of Session 2024-26 - 2 Statutory Instruments Reported,,2026-04-15,00:01:00,,"-1 day, 23:19:33"
52647,HC 1791,2024-26,Treasury Committee,Commons,AI in financial services: Responses to the Committee’s Fifteenth Report,7th Special Report,2026-04-16,00:01:00,,"-1 day, 23:19:38"
52652,HC 1821,2024-26,Treasury Committee,Commons,Appointment of Katharine Braddick as Deputy Governor for Prudential Regulation at the Bank of England and Chief Executive of the Prudential Regulation Authority,16th Report,2026-04-16,11:00:00,,"-1 day, 23:20:32"
52645,HC 1628,2024-26,"Culture, Media and Sport Committee",Commons,Fan-led review of live and electronic music,5th Special Report,2026-04-17,00:01:00,,"-1 day, 23:19:26"
52649,,,"Culture, Media and Sport Committee",Commons,Live and electronic music fans’ charter,,2026-04-17,00:01:00,,"-1 day, 23:19:26"
52650,,,"Culture, Media and Sport Committee",Commons,Siarter cefnogwyr cerddoriaeth fyw ac electronig,,2026-04-17,00:01:00,,"-1 day, 23:19:26"
52653,HC 291-liii,2024-26,Statutory Instruments (Joint Committee),Joint,Fifty-third Report - 2 Statutory Instruments Reported,,2026-04-17,00:01:00,,"-1 day, 23:19:26"
52655,HC 1842,2024-26,Education Committee,Commons,Foundations of Learning: replacing RAAC and securing school buildings: Government Response,8th Special Report,2026-04-17,00:01:00,,"-1 day, 23:19:26"
52565,HC 1833,2024-26,"Environment, Food and Rural Affairs Committee",Commons,UK-EU agritrade: making an SPS agreement work - Government Response,5th Special Report,2026-04-17,00:00:00,,"-1 day, 23:20:26"
52586,HC 1832,2024-26,Business and Trade Committee,Commons,UK-India Comprehensive Economic and Trade Agreement (CETA): Government Response,7th Special Report,2026-04-17,11:00:00,,"-1 day, 23:20:27"
52665,HC 593,2024-26,"Culture, Media and Sport Committee",Commons,Game On: Community and school sport,4th Report,2026-04-20,00:00:00,,"-1 day, 23:20:23"
52672,HC 1829,2024-26,Procedure Committee,Commons,Elections within the House of Commons: Government Response,6th Special Report,2026-04-20,10:00:00,,0:20:26
52713,,,House of Commons Commission,Commons,External members of the House of Commons Commission: nomination of candidates,,2026-04-20,17:00:00,,6:20:32
52715,HC 1831,2024-26,"Housing, Communities and Local Government Committee",Commons,Housing Conditions in Temporary Accommodation,5th Report,2026-04-22,00:01:00,,"-1 day, 23:19:25"
52753,HC 1830,2024-26,International Development Committee,Commons,Future of UK aid and development assistance: interim report: Government Response,9th Special Report,2026-04-22,00:01:00,,"-1 day, 23:19:25"
52758,HC 1830,2024-26,International Development Committee,Commons,Large Print - 9th Special Report - Future of UK aid and development assistance: interim report: Government Response,,2026-04-22,00:01:00,,"-1 day, 23:19:25"
52760,HC 1705,2024-26,Public Accounts Committee,Commons,New Hospital Programme update,76th Report,2026-04-22,00:01:00,,"-1 day, 23:19:25"
52776,HC 852,2024-26,Environmental Audit Committee,Commons,Addressing the risks from Perfluoroalkyl and Polyfluoroalkyl Substances (PFAS),9th Report,2026-04-23,00:00:00,,"-1 day, 23:20:26"
52817,HC 1844,2024-26,"Science, Innovation and Technology Committee",Commons,Pre-appointment hearing for the Chair of UK Research and Innovation,4th Report,2026-04-23,11:00:00,,"-1 day, 23:20:30"
52816,HC 291-liv,2024-26,Statutory Instruments (Joint Committee),Joint,Fifty-fourth Report - 2 Statutory Instruments Reported,,2026-04-24,00:01:00,,"-1 day, 23:19:30"
52818,HC 887,2024-26,Public Accounts Committee,Commons,Accountability in small government bodies,77th Report,2026-04-24,00:01:00,,"-1 day, 23:19:30"
52821,HC 680,2024-26,"Environment, Food and Rural Affairs Committee",Commons,Resetting the relationship with fishing communities,7th Report,2026-04-24,00:01:00,,"-1 day, 23:19:30"
52823,HC 1836,2024-26,Transport Committee,Commons,Railways Bill: Government Response,4th Special Report,2026-04-24,11:00:00,,"-1 day, 23:20:28"
52826,HC 1856,2024-26,Public Accounts Commission,Commons,Report Work of the Commission in 2025,31st Report,2026-04-27,11:00:00,,"-1 day, 23:20:27"
52831,HC 841,2024-26,Defence Committee,Commons,AUKUS,8th Report,2026-04-28,00:01:00,,"-1 day, 23:19:29"
52832,HC 1851,2024-26,Statutory Instruments (Joint Committee),Joint,"Scrutinising Statutory Instruments: Departmental Returns, Session 2024-26",3rd Special Report,2026-04-28,00:01:00,,"-1 day, 23:19:29"
52833,HC 291-lv,2024-26,Statutory Instruments (Joint Committee),Joint,Fifty-fifth Report - 2 Statutory Instruments Reported,,2026-04-28,00:01:00,,"-1 day, 23:19:29"
52824,HC 1835,2024-26,International Development Committee,Commons,UK Aid and Development Assistance in a Fracturing World: Strengthening Resilience and Cooperation,11th Report,2026-04-28,00:00:00,,"-1 day, 23:20:29"
52825,HC 1835,2024-26,International Development Committee,Commons,Large Print - 11th Report - UK Aid and Development Assistance in a Fracturing World: Strengthening Resilience and Cooperation,,2026-04-28,00:00:00,,"-1 day, 23:20:29"
52834,HC 1853,2024-26,"Housing, Communities and Local Government Committee",Commons,Housing Conditions in the Social Rented Sector: Government Response,7th Special Report,2026-04-28,11:00:00,,"-1 day, 23:20:39"
52862,HC 1712,2024-26,Select Committee on the Armed Forces Bill,Commons,Armed Forces Bill 2026,1st Special Report,2026-04-29,00:01:00,,"-1 day, 23:19:30"
52865,HC 1732,2024-26,Public Accounts Committee,Commons,The Bank of England’s Real-Time Gross Settlement Renewal Programme,78th Report,2026-04-29,00:01:00,,"-1 day, 23:19:30"
52881,HC 1864,2024-26,"Environment, Food and Rural Affairs Committee",Commons,Pre-appointment hearing for the Chair-designate of the Office for Environmental Protection,9th Report,2026-04-29,09:00:00,,"-1 day, 23:20:29"
52882,HC 1864,2024-26,Environmental Audit Committee,Commons,Pre-appointment hearing for the Chair-designate of the Office for Environmental Protection,10th Report,2026-04-29,09:00:00,,"-1 day, 23:20:29"
