Publication ID,HC Number,Session,Committee Name,House,Report Title,Report Ordinal,Publication Date,Publication Time,Late by min,Late by max
52873,HC 1859,2024-26,Home Affairs Committee,Commons,Maccabi Tel Aviv fan ban: Government Response,4th Special Report,2026-04-29,10:00:00,,0:20:32
52903,,,Public Accounts Commission,Commons,2025 NAO Value for Money Governance Review,,2026-04-29,11:15:00,,12:05:33
52959,HC 1861,2024-26,"Environment, Food and Rural Affairs Committee",Commons,Failures at South East Water,8th Report,2026-05-01,00:01:00,,"-1 day, 23:19:25"
52963,HC 1852,2024-26,Transport Committee,Commons,Rail investment pipelines: ending boom and bust: Government Response,5th Special Report,2026-05-01,11:00:00,,"-1 day, 23:20:52"
52968,HC 1860,2024-26,Transport Committee,Commons,Engine for growth: securing skills for transport manufacturing: Government Response,6th Special Report,2026-05-05,11:00:00,,"-1 day, 23:20:35"
52980,HC 1863,2024-26,Women and Equalities Committee,Commons,"Discrimination, harassment and abuse against Muslim women: Government Response",10th Special Report,2026-05-12,00:01:00,,0:19:31
52984,HC 1863,2024-26,Women and Equalities Committee,Commons,"Large Print – 10th Special Report – Discrimination, harassment and abuse against Muslim women: Government Response",,2026-05-12,00:01:00,,0:19:31
52983,HC 807,2024-26,Education Committee,Commons,Higher Education and Funding: Threat of Insolvency and International Students,9th Report,2026-05-12,00:00:00,,0:20:31
52997,HC 1827,2026-27,Modernisation Committee,Commons,Large Print – 2nd Report – Virtual participation by Members in select committee meetings,,2026-05-14,09:00:00,,0:20:28
52995,HC 1827,2026-27,Modernisation Committee,Commons,Virtual participation by Members in select committee meetings,2nd Report,2026-05-14,08:55:00,,0:25:28
53044,HC 937,2026-27,Administration Committee,Commons,Health and Wellbeing,1st Report,2026-05-18,09:00:00,,0:20:34
53099,HC 986,2026-27,Home Affairs Committee,Commons,Mandatory to manageable: the government’s plans for digital ID,8th Report,2026-05-20,00:01:00,,0:19:42
53147,HC 1227,2026-27,Work and Pensions Committee,Commons,Employment support for disabled people: Disability at Work,7th Report,2026-05-21,00:01:00,,0:19:26
53153,HC 1227,2026-27,Work and Pensions Committee,Commons,Large print - 7th Report - Employment support for disabled people: Disability at Work,,2026-05-21,00:01:00,,0:19:26
53163,HC 1227,2026-27,Work and Pensions Committee,Commons,Easy Read - 7th Report - Employment support for disabled people: Disability at Work,,2026-05-21,00:01:00,,0:19:26
53167,HC 1227,2026-27,Work and Pensions Committee,Commons,Audio summary - 7th Report - Employment support for disabled people: Disability at Work,,2026-05-21,00:01:00,,0:19:26
53168,HC 187,2026-27,Education Committee,Commons,Growing up in the online world: The Education Committee’s response to the Government’s consultation,1st Report,2026-05-21,00:01:00,,0:19:26
53182,HC 1227,2026-27,Work and Pensions Committee,Commons,BSL report summary - 7th Report - Employment support for disabled people: Disability at Work,,2026-05-21,00:01:00,,0:19:26
53154,HC 164,2026-27,Scottish Affairs Committee,Commons,Clean Power by 2030: A fair deal for Scotland?,1st Report,2026-05-21,00:00:00,,0:20:26
53169,HC 108,2026-27,Foreign Affairs Committee,Commons,From a Common Understanding to Common Ground: Building a UK-EU Strategic Partnership fit for the future: Government Response,1st Special Report,2026-05-21,09:00:00,,0:20:31
53181,HC 181,2026-27,Parliamentary Works Estimates Commission,Joint,Parliamentary Works Grant: Main Estimate for 2026–27: Comments from the Parliamentary Works Estimates Commission and the Treasury,,2026-05-21,11:00:00,,0:20:34
53187,HC 1180,2026-27,Health and Social Care Committee,Commons,Healthy Ageing: physical activity in an ageing society,8th Report,2026-05-22,00:01:00,,0:19:28
53188,HC 1180,2026-27,Health and Social Care Committee,Commons,Large Print – 8th Report – Healthy Ageing: physical activity in an ageing society,,2026-05-22,00:01:00,,0:19:28
53191,HC 172-i,2026-27,Statutory Instruments (Joint Committee),Joint,First Report - 4 Statutory Instruments Reported,,2026-05-22,00:01:00,,0:19:28
53197,HC 94,2026-27,Public Accounts Committee,Commons,Second Report - NAO financial audit insights 2024–25,,2026-05-22,00:01:00,,0:19:28
53200,HC 55,2026-27,"Science, Innovation and Technology Committee",Commons,Pre-appointment hearing for the Chair of Ofcom,2nd Report,2026-05-22,00:01:00,,0:19:28
53201,HC 131,2026-27,Business and Trade Committee,Commons,The regulation of postal services,2nd Report,2026-05-22,00:01:00,,0:19:28
53229,HC 128,2026-27,Business and Trade Committee,Commons,Competition and market functioning in the UK live music industry,3rd Report,2026-05-24,00:01:00,,0:19:28
53249,HC 40,2026-27,"Housing, Communities and Local Government Committee",Commons,Pre-legislative scrutiny of the draft Commonhold and Leasehold Reform Bill,1st Report,2026-05-27,00:01:00,,0:19:29
53252,HC 136,2026-27,Welsh Affairs Committee,Commons,Promoting Wales for Inward Investment,1st Report,2026-05-27,00:01:00,,0:19:29
53257,HC 136,2026-27,Welsh Affairs Committee,Commons,Crynodeb - Hyrwyddo Cymru fel cyrchfan ar gyfer Mewnfuddsoddi,1st Report,2026-05-27,00:01:00,,0:19:29
53253,HC 184,2026-27,Northern Ireland Affairs Committee,Commons,Policing and security in Northern Ireland,1st Report,2026-05-27,00:00:00,,0:20:29
53273,HC 40,2026-27,"Housing, Communities and Local Government Committee",Commons,Large Print - 1st Report - Pre-legislative scrutiny of the draft Commonhold and Leasehold Reform Bill,,2026-05-27,00:01:00,0:19:29,"1 day, 0:19:31"
